{"type":"config","name":"Optimize nix-store caching for Rust builds in unit2nix","metricName":"noop_rebuild_ms","metricUnit":"ms","bestDirection":"lower"}
{"run":1,"commit":"1efdb33","metric":0,"metrics":{},"status":"crash","description":"Baseline noop rebuild benchmark attempt using hyperfine failed because hyperfine is not available in the environment.","timestamp":1776908180219,"segment":0,"confidence":null,"iterationTokens":252}
{"run":2,"commit":"1efdb33","metric":0,"metrics":{},"status":"crash","description":"Second baseline attempt failed because the shell pipeline fed no timing samples into Python; need a more robust timing harness before comparing caching changes.","timestamp":1776908211170,"segment":0,"confidence":null,"iterationTokens":345}
{"run":3,"commit":"84169f9","metric":1153.391,"metrics":{},"status":"keep","description":"Baseline noop rebuild benchmark established with a simple Python timing harness around `nix build .#sample --no-link`; first two runs were coldish, last three were warm, so this is a noisy but usable starting point.","timestamp":1776908233516,"segment":0,"confidence":null,"iterationTokens":423}
{"run":4,"commit":"e02edb3","metric":182.15,"metrics":{},"status":"keep","description":"Refined baseline by discarding first three coldish runs and averaging only steady-state noop rebuild timings; warm-cache baseline for `nix build .#sample --no-link` is about 182 ms.","timestamp":1776908252832,"segment":0,"confidence":null,"iterationTokens":599}
{"run":5,"commit":"19c1ec4","metric":65.746,"metrics":{},"status":"keep","description":"Added two low-risk cache improvements: local source filtering now ignores common result/.direnv noise and git sources use fixed-output `pkgs.fetchgit` when sha256 is available, cutting warm noop rebuild time substantially without changing benchmark semantics.","timestamp":1776908335330,"segment":0,"confidence":0.5648087694580941,"iterationTokens":7408}
{"run":6,"commit":"b123eb7","metric":64.092,"metrics":{},"status":"keep","description":"Re-ran the same cacheability change to confirm signal; warm noop rebuild remains about 64 ms, suggesting the fetch-source cleanup reduced eval/build noise rather than landing a one-off lucky sample.","timestamp":1776908350879,"segment":0,"confidence":1.08577140049806,"iterationTokens":688}
{"run":7,"commit":"b123eb7","metric":0,"metrics":{},"status":"checks_failed","description":"Post-change verification failed: `nix develop -c cargo test` now trips a regression after the fetch-source caching changes, so inspect logs and fix before keeping further optimizations.","timestamp":1776908373398,"segment":0,"confidence":1.08577140049806,"iterationTokens":441}
{"run":8,"commit":"b123eb7","metric":0,"metrics":{},"status":"checks_failed","description":"Cargo-test verification also fails on the reverted baseline, so the chosen post-check is not a stable acceptance rail in this environment; need a repo-native cheaper check before continuing.","timestamp":1776908405388,"segment":0,"confidence":1.08577140049806,"iterationTokens":305}
{"run":9,"commit":"411a48f","metric":88.088,"metrics":{},"status":"keep","description":"Current reverted baseline re-measured with the same warm-cache harness; steady-state noop rebuild sits around 88 ms, so further experiments should compare against this tighter baseline rather than the earlier cold-skewed 182 ms run.","timestamp":1776908432102,"segment":0,"confidence":2.670945157526255,"iterationTokens":8075}
{"run":10,"commit":"411a48f","metric":117.477,"metrics":{},"status":"discard","description":"Replaying the local-source-filter plus fetchgit change after resetting the baseline produced a worse warm noop rebuild mean (~117 ms vs ~88 ms baseline), so keep the idea in notes but discard this version as not reliably beneficial.","timestamp":1776908474719,"segment":0,"confidence":1.6927119785545446,"iterationTokens":3309}
{"run":11,"commit":"411a48f","metric":676.244,"metrics":{},"status":"discard","description":"Tried a broader benchmark variant that measures rebuild time after touching README in a fresh repo copy, but it changes the workload away from the primary noop metric and is not comparable to the established baseline; keep as a future secondary rail, not as the optimization metric.","timestamp":1776908494731,"segment":0,"confidence":1.200561955605507,"iterationTokens":726}
{"run":12,"commit":"b2e74bd","metric":62.288,"metrics":{},"status":"keep","description":"Resumed with a fresh harness run after documenting the experiment; warm noop rebuild now measures around 62 ms, so use this tighter steady-state baseline for subsequent comparisons rather than the older 88 ms sample.","timestamp":1776908547401,"segment":0,"confidence":1.5732272526362314,"iterationTokens":3676}
{"run":13,"commit":"b2e74bd","metric":66.185,"metrics":{},"status":"discard","description":"Filtered the auto-mode source tree before the IFD copy to avoid hashing target/result noise, but the noop metric regressed slightly (~66 ms vs ~62 ms baseline), so discard this version for the current benchmark.","timestamp":1776908576388,"segment":0,"confidence":2.414263565891473,"iterationTokens":4545}
{"run":14,"commit":"b2e74bd","metric":0,"metrics":{},"status":"crash","description":"Tried to add a secondary auto-mode README-touch benchmark, but `nix build .#sample-auto --no-link` failed in the fresh copy before measurement; inspect whether the attr or copied repo setup is wrong before using this rail.","timestamp":1776908591286,"segment":0,"confidence":2.414263565891473,"iterationTokens":700}
{"run":15,"commit":"b2e74bd","metric":68.865,"metrics":{},"status":"discard","description":"Tested a longer 12-run harness variant to reduce noise, but that changes the benchmark procedure itself; keep the observation that steady-state noop rebuilds cluster around the high-60 ms range, yet discard it as a benchmark-definition change rather than a product improvement.","timestamp":1776908611575,"segment":0,"confidence":4.074706440323164,"iterationTokens":1594}
{"run":16,"commit":"b2e74bd","metric":78.456,"metrics":{},"status":"discard","description":"Exposed `sample-auto` as a package target and fixed flake check wiring so `nix flake show` and `nix build .#sample-auto` work as correctness rails, but this commit only changes measurement infrastructure and slightly worsens the primary noop metric. Keep the idea as tooling, discard as an optimization result.","timestamp":1776908709675,"segment":0,"confidence":4.336396546922861,"iterationTokens":2762}
{"run":17,"commit":"b2e74bd","metric":86.829,"metrics":{},"status":"discard","description":"Kept the sample-auto exposure and widened the harness to warm auto mode too, but this materially changed the benchmark workload and worsened the primary noop metric. Useful experiment infrastructure only; discard as an optimization result.","timestamp":1776908787468,"segment":0,"confidence":3.5144299940756616,"iterationTokens":1408}
{"run":18,"commit":"b2e74bd","metric":65.681,"metrics":{},"status":"discard","description":"Added temporary auto-mode exposure plus a separate secondary benchmark script for README-touch invalidation on `.#sample-auto`. Primary noop metric stayed slightly worse than the 62 ms baseline, and the secondary rail showed very large auto rebuild costs (~27.3 s mean) but no product optimization yet, so discard this instrumentation-only step.","timestamp":1776909310969,"segment":0,"confidence":4.875772994129156,"iterationTokens":3765}
{"run":19,"commit":"b2e74bd","metric":67.169,"metrics":{},"status":"discard","description":"Tested filtered auto-mode source copying against a separate auto README-touch rail. Secondary mean improved from ~27.3 s to ~24.6 s, but the primary noop metric still regressed versus the 62 ms baseline, so discard for now and keep as evidence that auto-mode invalidation breadth can improve on a different workload.","timestamp":1776909508540,"segment":0,"confidence":5.948904063798289,"iterationTokens":1985}
{"run":20,"commit":"b2e74bd","metric":70.148,"metrics":{},"status":"checks_failed","description":"Resume baseline run confirmed primary noop timing remains in the ~70 ms band, but checks failed because the temporary `sample-auto` scaffolding was reverted and the current `autoresearch.checks.sh` still expects that attr. Fix rails before further product experiments.","timestamp":1776909575994,"segment":0,"confidence":7.92468193384224,"iterationTokens":3872}
{"run":21,"commit":"c87f69a","metric":59.722,"metrics":{},"status":"keep","description":"Repaired the acceptance rail so checks only assert the stable `.#sample` build, then re-ran the baseline. Warm noop rebuild now measures about 59.7 ms, which is the best current baseline for further comparisons.","timestamp":1776909587950,"segment":0,"confidence":7.38767936665017,"iterationTokens":575}
{"run":22,"commit":"c87f69a","metric":68.258,"metrics":{},"status":"discard","description":"Tried a lighter auto-mode pruning strategy that removes target/result/.direnv after copying instead of using a filtered source path. Secondary auto README-touch mean improved a bit further to ~24.0 s, but the primary noop metric still regressed from the 59.7 ms baseline, so discard under the current objective.","timestamp":1776909778894,"segment":0,"confidence":9.080431807815115,"iterationTokens":1924}
{"run":23,"commit":"c87f69a","metric":227.197,"metrics":{},"status":"discard","description":"Added a secondary benchmark that compares auto-mode README-touch invalidation against real source-edit invalidation. It showed unrelated README edits are far more expensive (~23.4 s) than real source edits (~6.0 s), confirming the cache-breadth problem is real; but because the combined command changed the primary workload and inflated the noop metric, discard this as measurement-only evidence.","timestamp":1776910032124,"segment":0,"confidence":7.38767936665017,"iterationTokens":2505}
{"run":24,"commit":"c87f69a","metric":96.783,"metrics":{},"status":"discard","description":"Tried an even narrower auto-mode prune that removes only `result` symlinks after copy. Secondary auto rails improved materially versus the broad baseline (~23.1 s README touch, ~1.73 s source touch), but the combined measurement command again changes the primary workload and the noop metric regressed badly. Discard as evidence only, not a kept optimization.","timestamp":1776910245485,"segment":0,"confidence":7.188493018777076,"iterationTokens":2152}
{"run":25,"commit":"c87f69a","metric":63.622,"metrics":{},"status":"discard","description":"Resume baseline spot-check came in a bit slower than the best kept 59.7 ms run, which reinforces that this benchmark still has meaningful noise. No code change here, so discard as calibration only.","timestamp":1776910294115,"segment":0,"confidence":7.38767936665017,"iterationTokens":6475}
{"run":26,"commit":"c87f69a","metric":71.408,"metrics":{},"status":"discard","description":"Retried the `result*`-only post-copy prune against the clean primary harness. The primary noop metric clearly regressed to ~71.4 ms versus the 59.7 ms baseline, so discard immediately; secondary measurement replay tooling also failed to apply the patch cleanly, so no new supporting evidence was needed.","timestamp":1776910344546,"segment":0,"confidence":7.59821882951654,"iterationTokens":551}
{"run":27,"commit":"c87f69a","metric":95.191,"metrics":{},"status":"discard","description":"Hoisted `workspaceMemberIds` out of the clippy builder to avoid recomputing it during evaluation, but this produced a much worse noop metric (~95 ms vs 59.7 ms baseline), so the change is either noise-unfriendly or not beneficial. Discard.","timestamp":1776910503640,"segment":0,"confidence":7.38767936665017,"iterationTokens":11043}
{"run":28,"commit":"c87f69a","metric":0,"metrics":{},"status":"crash","description":"Tried to defer sample workspace construction in `flake.nix` by replacing the shared value with a factory function, but the flake no longer evaluated for `.#sample`. Need to inspect the syntax/attr wiring before benchmarking.","timestamp":1776910570402,"segment":0,"confidence":7.38767936665017,"iterationTokens":1464}
{"run":29,"commit":"c87f69a","metric":69.365,"metrics":{},"status":"discard","description":"Tried routing `packages.sample-bin` through a `members = [\"sample-bin\"]` build plan so the common `.#sample-bin` path would expose a smaller workspace projection, but the main noop metric for `.#sample` regressed to ~69.4 ms. Discard under the current objective.","timestamp":1776910587529,"segment":0,"confidence":7.59821882951654,"iterationTokens":715}
{"run":30,"commit":"c87f69a","metric":69.968,"metrics":{},"status":"discard","description":"Factored test/clippy output attr construction into helper functions to see whether reducing top-level expression size would help the common `.#sample` path, but noop rebuild still regressed to about 70 ms. Discard.","timestamp":1776910630031,"segment":0,"confidence":8.407996621146001,"iterationTokens":1905}
{"run":31,"commit":"c87f69a","metric":72.567,"metrics":{},"status":"discard","description":"Tried bypassing `cleanSourceWith` for simple non-root local subpaths in `lib/fetch-source.nix`, on the theory that sample/manual builds pay unnecessary source-cleaning cost for obvious crate directories. The noop metric still regressed badly to ~72.6 ms, so discard.","timestamp":1776910702707,"segment":0,"confidence":9.151394422310762,"iterationTokens":7749}
{"run":32,"commit":"c87f69a","metric":71.431,"metrics":{},"status":"discard","description":"Tried removing duplicate sample workspace construction inside `nix/checks.nix` by hoisting member-filtered and auto sample workspaces into `flake.nix` and passing them down, but the primary noop metric still regressed to ~71.4 ms. Discard.","timestamp":1776910767805,"segment":0,"confidence":8.62909984106344,"iterationTokens":3221}
{"run":33,"commit":"c87f69a","metric":67.782,"metrics":{},"status":"discard","description":"Calibration run after probing attribute timings: `.#sample` and `.#sample-bin` are very close in warm timing (~68.5 ms vs ~66.6 ms from direct shell measurement), which suggests `allWorkspaceMembers`/symlinkJoin is not the dominant cost in the common sample path. No product change, so discard.","timestamp":1776911144373,"segment":0,"confidence":9.86162483487451,"iterationTokens":1600}
{"run":34,"commit":"c87f69a","metric":68.399,"metrics":{},"status":"discard","description":"Fixed a latent `nix/checks.nix` wiring bug by passing `unit2nix` into the checks import, then reran the primary harness. The noop metric remains slower than the best kept baseline, so discard as optimization evidence even though the flake checks path is now less broken.","timestamp":1776911161891,"segment":0,"confidence":11.548293531857308,"iterationTokens":545}
{"run":35,"commit":"c87f69a","metric":77.018,"metrics":{},"status":"discard","description":"Precomputed per-crate sources and host/target feature arrays in `lib/build-from-unit-graph.nix` so normal/test/clippy paths could reuse them, but the noop metric regressed sharply to ~77 ms. Discard.","timestamp":1776911222551,"segment":0,"confidence":9.86162483487451,"iterationTokens":4157}
{"run":36,"commit":"c87f69a","metric":117.157,"metrics":{},"status":"discard","description":"Tried a smaller laziness-preserving refactor by combining per-crate version and extern-name lookups into one shared map, but the noop metric became dramatically worse and unstable. Discard.","timestamp":1776911316164,"segment":0,"confidence":9.240600340399194,"iterationTokens":1178}
{"run":37,"commit":"c87f69a","metric":74.158,"metrics":{},"status":"discard","description":"Measurement-only probe: `nix eval` of sample drvPaths is much slower (~522–534 ms steady) than warm `nix build --no-link` (~72 ms), and `sample` vs `sample-bin` are nearly identical in both modes. That points away from symlinkJoin and toward shared flake/eval overhead as the dominant cost. No product change, so discard.","timestamp":1776911722076,"segment":0,"confidence":10.428147372097078,"iterationTokens":1275}
{"run":38,"commit":"d4988b5","metric":59.179,"metrics":{},"status":"discard","description":"Made the checks import self-contained by binding `unit2nix = self.packages.${system}.unit2nix` locally in `flake.nix` instead of relying on a missing inherited argument. The first run looked slightly faster, but the immediate rerun regressed, so treat the performance effect as noise while keeping the correctness lesson.","timestamp":1776911768248,"segment":0,"confidence":9.156583629893237,"iterationTokens":3695}
{"run":39,"commit":"d4988b5","metric":60.937,"metrics":{},"status":"discard","description":"Re-ran the self-contained checks-import change to confirm signal. The second run regressed to ~60.94 ms, so the first improvement was likely within noise; keep the correctness fix commit, but treat the performance effect as neutral under this benchmark.","timestamp":1776911782708,"segment":0,"confidence":9.068188783328232,"iterationTokens":519}
{"run":40,"commit":"d4988b5","metric":68.097,"metrics":{},"status":"discard","description":"Tried one more flake-eval cleanup by packaging the checks import arguments into a single `checksArgs` attrset before importing `nix/checks.nix`, but the noop metric regressed sharply to ~68.1 ms. Discard.","timestamp":1776911876895,"segment":0,"confidence":9.543460732139987,"iterationTokens":1672}
{"run":41,"commit":"d4988b5","metric":69.724,"metrics":{},"status":"discard","description":"Tried making the package set slightly lazier by factoring the sample outputs into a separate `samplePackages` attrset merged into `packages`, but the noop metric regressed to ~69.7 ms. Discard.","timestamp":1776911897542,"segment":0,"confidence":10.07130701157249,"iterationTokens":610}
{"run":42,"commit":"d4988b5","metric":66.764,"metrics":{},"status":"discard","description":"Measurement-only boundary probe: warm `nix eval` of `unit2nix.drvPath` (~678 ms) is even slower than `sample.drvPath` (~471 ms), while warm `nix build --no-link` stays much cheaper (`unit2nix` ~88 ms, `sample` ~64 ms). This strongly suggests global flake evaluation dominates the cost, not sample-specific workspace wiring. No product change, so discard.","timestamp":1776912015058,"segment":0,"confidence":11.758195907013707,"iterationTokens":1654}
{"run":43,"commit":"d4988b5","metric":63.226,"metrics":{},"status":"discard","description":"Tried a very small flake-eval cleanup by reusing `pkgs.lib` through a `libForSystem` binding instead of re-reading it inside `vendorMultipleCargoDeps`, but the noop metric still came in slower than the best baseline. Discard.","timestamp":1776912092783,"segment":0,"confidence":10.50763494318181,"iterationTokens":3195}
{"run":44,"commit":"d4988b5","metric":64.302,"metrics":{},"status":"discard","description":"Tried hoisting the crate override exports into shared bindings so the `lib` output would reuse them directly, but the primary noop metric still remained slower than the best baseline. Discard.","timestamp":1776912106028,"segment":0,"confidence":11.066666666666674,"iterationTokens":602}
{"run":45,"commit":"d4988b5","metric":69.3,"metrics":{},"status":"discard","description":"Resume calibration run came in far above the best kept baseline, reinforcing that the current primary metric is very noisy even without code changes. No product change, so discard.","timestamp":1776912132245,"segment":0,"confidence":11.688524590163961,"iterationTokens":2832}
{"run":46,"commit":"d4988b5","metric":77.26,"metrics":{},"status":"discard","description":"Tried removing the generic `pick` helper and materializing `libBySystem`/`packagesBySystem`/`checksBySystem`/`devShellsBySystem` explicitly in `flake.nix`, but the noop metric regressed sharply to ~77.3 ms. Discard.","timestamp":1776912150930,"segment":0,"confidence":11.066666666666674,"iterationTokens":816}
